{
  "project":"Example Retro RPG",
  "build_id":"RC-001",
  "source_id":"clean-rev1",
  "source_sha256":null,
  "source_size":null,
  "source_format":"ROM",
  "baseline_id":"last-known-good",
  "baseline_sha256":null,
  "output_id":"RC-001",
  "output_sha256":null,
  "output_size":null,
  "stages":{"SOURCE_QA":"PASS","STATIC_BINARY_QA":"PASS","RC_BUILD":"PASS","RC_READBACK_QA":"PASS","RUNTIME_SMOKE":"NOT_RUN","CANONICAL_PROMOTION":"BLOCKED","PATCH_PACKAGE":"BLOCKED","RELEASE":"BLOCKED"},
  "build_fail_codes":[],
  "build_warnings":["Runtime evidence not collected"],
  "protected_region_status":"PASS",
  "missing_glyphs":0,
  "overflow_count":0,
  "pointer_offset_size_mismatch_count":0,
  "physical_overlap_count":0,
  "physical_out_of_range_count":0,
  "lkg_id":"last-known-good",
  "fkb_id":null,
  "runtime_test_path":null,
  "release_state":"READY_FOR_RUNTIME",
  "build_issues":[]
}
